{
  "$schema": "https://json-schema.org/draft/2020-12/schema",
  "$id": "https://webuildconsortium.eu/schemas/site-attestation/0.4.0/site-attestation-schema.json",
  "title": "Site Attestation",
  "description": "SD-JWT VC schema for the WeBuild Site Attestation (vct: eu.we-build:site:1). Provides a standardized, verifiable digital representation of a specific physical location (site) operated by an economic operator.",
  "type": "object",
  "required": [
    "vct",
    "iss",
    "iat",
    "exp",
    "attestation_legal_category",
    "parent_economic_operator_main_id",
    "parent_economic_operator_id",
    "site_name",
    "site_main_id",
    "site_main_address"
  ],
  "properties": {

    "vct": {
      "type": "string",
      "const": "eu.we-build:site:1",
      "description": "Verifiable Credential Type identifier. SHALL be the fixed string 'eu.we-build:site:1'."
    },

    "iss": {
      "type": "string",
      "description": "Issuer identifier (DID or URI) of the economic operator that issued this attestation.",
      "minLength": 1
    },

    "iat": {
      "type": "integer",
      "description": "Issued-at time as a Unix timestamp (seconds since epoch). SHALL be in the past.",
      "minimum": 0
    },

    "exp": {
      "type": "integer",
      "description": "Expiry time as a Unix timestamp (seconds since epoch). SHALL be greater than iat.",
      "minimum": 0
    },

    "jti": {
      "type": "string",
      "description": "Unique identifier for this credential instance (JWT ID).",
      "minLength": 1
    },

    "attestation_legal_category": {
      "type": "string",
      "const": "EAA",
      "description": "Legal category of this attestation as defined by eIDAS 2. SHALL be 'EAA'. NOT selectively disclosable."
    },

    "parent_economic_operator_main_id": {
      "type": "string",
      "description": "Primary unique identifier of the economic operator that operates this site. Preferred: EUID for EU-registered entities. SHALL be non-empty.",
      "minLength": 1
    },

    "parent_economic_operator_id": {
      "type": "object",
      "description": "Structured object containing economic operator identifiers. At least one sub-field SHALL be provided. All sub-fields are individually optional.",
      "properties": {

        "euid": {
          "type": "string",
          "description": "European Unique Identifier per Directive (EU) 2017/1132. Preferred identifier for EU legal entities.",
          "minLength": 1
        },

        "lei": {
          "type": "string",
          "description": "Legal Entity Identifier per ISO 17442. 20-character alphanumeric code.",
          "pattern": "^[A-Z0-9]{18}[0-9]{2}$",
          "minLength": 20,
          "maxLength": 20
        },

        "tax": {
          "type": "string",
          "description": "National tax or registration number.",
          "minLength": 1
        },

        "gln": {
          "type": "string",
          "description": "Global Location Number for legal entities — GS1 identifier. 13-digit numeric string.",
          "pattern": "^[0-9]{13}$",
          "minLength": 13,
          "maxLength": 13
        },

        "duns": {
          "type": "string",
          "description": "Data Universal Numbering System — Dun & Bradstreet company identifier. 9-digit numeric string.",
          "pattern": "^[0-9]{9}$",
          "minLength": 9,
          "maxLength": 9
        },

        "eori": {
          "type": "string",
          "description": "Economic Operators Registration and Identification number — EU customs identifier.",
          "pattern": "^[A-Z]{2}[A-Z0-9]{1,15}$",
          "minLength": 3
        },

        "bpnl": {
          "type": "string",
          "description": "Business Partner Number Legal entity — Catena-X identifier per International Code Designator (ICD): 0243.",
          "pattern": "^BPNL[A-Z0-9]{12}$",
          "minLength": 16,
          "maxLength": 16
        },

        "siren": {
          "type": "string",
          "description": "Système d'Identification du Répertoire des ENtreprises — French company identifier. 9-digit numeric string.",
          "pattern": "^[0-9]{9}$",
          "minLength": 9,
          "maxLength": 9
        }

      },
      "additionalProperties": false,
      "minProperties": 1
    },

    "site_name": {
      "type": "string",
      "description": "The name of the site. SHALL be non-empty.",
      "minLength": 1
    },

    "site_main_id": {
      "type": "string",
      "description": "Globally unique identifier of the site generated by the EBW as a UUID. SHALL NOT change during the lifecycle of the site.",
      "format": "uuid",
      "pattern": "^[0-9a-fA-F]{8}-[0-9a-fA-F]{4}-[0-9a-fA-F]{4}-[0-9a-fA-F]{4}-[0-9a-fA-F]{12}$"
    },

    "site_additional_ids": {
      "type": "array",
      "description": "Array of additional site-level identifiers. MAY contain zero or more entries. SHALL use identifier type codes from Section 2.8.2 (BPNS, GLN_site, SIRET, DUNS_site).",
      "items": {
        "type": "string",
        "minLength": 1
      },
      "uniqueItems": true
    },

    "site_main_address": {
      "$ref": "#/$defs/Address",
      "description": "Physical main address of the site. SHALL be present and SHALL contain street, nr, postal_code, and city."
    },

    "site_additional_addresses": {
      "type": "array",
      "description": "Array of additional addresses associated to the site (e.g., additional entrances or addresses of external/rented buildings). MAY contain zero or more entries.",
      "items": {
        "$ref": "#/$defs/Address"
      }
    },

    "status": {
      "type": "object",
      "description": "Revocation status claim. MUST be present if the validity period is greater than 24 hours.",
      "required": [
        "type",
        "status_list_credential",
        "status_list_index",
        "status_purpose"
      ],
      "properties": {

        "type": {
          "type": "string",
          "const": "status-list",
          "description": "SHALL be 'status-list'."
        },

        "status_list_credential": {
          "type": "string",
          "format": "uri",
          "description": "URI of the Status List Credential document containing the status bitstring.",
          "minLength": 1
        },

        "status_list_index": {
          "type": "integer",
          "description": "Zero-based index into the status list bitstring corresponding to this credential.",
          "minimum": 0
        },

        "status_purpose": {
          "type": "string",
          "const": "revocation",
          "description": "SHALL be 'revocation'."
        }

      },
      "additionalProperties": false
    },

    "trust_anchor_url": {
      "type": "string",
      "format": "uri",
      "description": "URL where the trust anchor for verifying this attestation can be retrieved. Optional metadata.",
      "minLength": 1
    },

    "schema_version": {
      "type": "string",
      "description": "Version of the schema used for this attestation. Optional metadata.",
      "minLength": 1,
      "pattern": "^[0-9]+\\.[0-9]+\\.[0-9]+$"
    },

    "cnf": {
      "type": "object",
      "description": "Confirmation claim binding the credential to the holder's key material per RFC 7800.",
      "properties": {
        "jwk": {
          "type": "object",
          "description": "JSON Web Key of the holder.",
          "required": ["kty"],
          "properties": {
            "kty": { "type": "string" },
            "crv": { "type": "string" },
            "x":   { "type": "string" },
            "y":   { "type": "string" },
            "n":   { "type": "string" },
            "e":   { "type": "string" }
          }
        }
      }
    }

  },

  "additionalProperties": false,

  "$defs": {
    "Address": {
      "type": "object",
      "title": "Address",
      "description": "Physical address object per Core Location Vocabulary.",
      "required": [
        "street",
        "nr",
        "postal_code",
        "city"
      ],
      "properties": {

        "street": {
          "type": "string",
          "description": "Street name of the address.",
          "minLength": 1
        },

        "nr": {
          "type": "string",
          "description": "House or building number of the address.",
          "minLength": 1
        },

        "postal_code": {
          "type": "string",
          "description": "Postal code of the address.",
          "minLength": 1
        },

        "city": {
          "type": "string",
          "description": "City of the address.",
          "minLength": 1
        }

      },
      "additionalProperties": false
    }
  }
}